{
  "$schema": "./schema/questions.schema.json",
  "status_options": [
    {
      "id": "new",
      "label": "New"
    },
    {
      "id": "shaky",
      "label": "Shaky"
    },
    {
      "id": "known",
      "label": "Known"
    }
  ],
  "openers": [
    {
      "id": "about-you",
      "q": "Tell me about yourself.",
      "outline": [
        "Use the 60-second pitch on the Leadership Principles page.",
        "Oracle, July 2022 to January 2025 (about 2.5 years): 37,000+ tenants, MTTR 94 to 26 minutes.",
        "Forward deployed at MSRcosmos: customer-facing, 12 entities, 3 days to 5.5 hours.",
        "Candidate confirmation: if this reflects your motivation, close on connecting customer problems to architecture decisions."
      ]
    },
    {
      "id": "why-aws",
      "q": "Why AWS?",
      "outline": [
        "Connect your verified infrastructure and customer-facing work to AWS: explain why its service choices and Well-Architected approach interest you.",
        "Explain what you want to learn from this team's customers; confirm the actual team and account scope with the recruiter.",
        "Name one specific thing you would like to work on, such as generative AI on Bedrock for regulated customers."
      ]
    },
    {
      "id": "why-sa",
      "q": "Why Solutions Architect and not SDE?",
      "outline": [
        "Candidate confirmation: identify your genuine reason for choosing SA. If customer-facing work motivates you, use your verified MSRcosmos migration and human-review routing experience as evidence.",
        "Connect the role to a measurable customer outcome such as Oracle MTTR; explain your own contribution without assuming this was your personal motivation.",
        "If accurate, explain how technical depth, proof-of-concept work, and customer communication fit your career goals. Supply a concrete example."
      ]
    },
    {
      "id": "why-awsi",
      "q": "Why AWSI - ETP Solutions Architect?",
      "outline": [
        "The recruiter confirms the AWSI - ETP Solutions Architect full-time role. Explain your genuine motivation for that role; the email does not establish strategic-account scope or a specialty.",
        "Connect your migration and operations experience to designing solutions for customer challenges. Choose one supported example and explain the customer outcome and your contribution.",
        "Explain how you would partner with sales while grounding recommendations in customer requirements, technical evidence, and measurable success.",
        "Practise the same recommendation for an engineer and an executive: design choices and failure modes for the engineer; business impact, risk, and next step for the executive."
      ]
    },
    {
      "id": "fav-lp",
      "q": "Which Leadership Principle resonates most with you?",
      "outline": [
        "Choose the principle that genuinely resonates with you, confirm your reason, and attach a verified example within one sentence.",
        "Possible evidence: S1 human-review routing. Confirm the actual customer need and why you chose that safeguard; do not infer auditor requirements from the presence of a review step."
      ]
    }
  ],
  "lp_questions": [
    {
      "id": "co-above",
      "lp": "customer-obsession",
      "q": "Tell me about a time you went above and beyond for a customer."
    },
    {
      "id": "co-no",
      "lp": "customer-obsession",
      "q": "Tell me about a time you had to say no to a customer."
    },
    {
      "id": "own-outside",
      "lp": "ownership",
      "q": "Tell me about a time you took on something outside your role."
    },
    {
      "id": "own-nobody",
      "lp": "ownership",
      "q": "Tell me about a problem nobody owned that you fixed."
    },
    {
      "id": "is-simplify",
      "lp": "invent-and-simplify",
      "q": "Tell me about a time you simplified a complex process."
    },
    {
      "id": "rl-incomplete",
      "lp": "are-right-a-lot",
      "q": "Tell me about a decision you made with incomplete data."
    },
    {
      "id": "rl-wrong",
      "lp": "are-right-a-lot",
      "q": "Tell me about a time your judgment was wrong."
    },
    {
      "id": "lc-fast",
      "lp": "learn-and-be-curious",
      "q": "How did you learn a new technology fast?"
    },
    {
      "id": "lc-recent",
      "lp": "learn-and-be-curious",
      "q": "What have you learned recently outside work?"
    },
    {
      "id": "hs-refuse",
      "lp": "highest-standards",
      "q": "Tell me about a time you refused to ship something that was not good enough."
    },
    {
      "id": "tb-bold",
      "lp": "think-big",
      "q": "Tell me about a time you proposed a bold direction."
    },
    {
      "id": "ba-quick",
      "lp": "bias-for-action",
      "q": "Tell me about a decision you made quickly with a calculated risk."
    },
    {
      "id": "fr-less",
      "lp": "frugality",
      "q": "Tell me about a time you achieved more with less."
    },
    {
      "id": "et-feedback",
      "lp": "earn-trust",
      "q": "Tell me about a time you received tough feedback."
    },
    {
      "id": "et-skeptic",
      "lp": "earn-trust",
      "q": "Tell me about a time you built trust with a skeptical stakeholder."
    },
    {
      "id": "dd-details",
      "lp": "dive-deep",
      "q": "Tell me about a problem you only solved by going into the details."
    },
    {
      "id": "dd-when",
      "lp": "dive-deep",
      "q": "How do you know when to dive deep?"
    },
    {
      "id": "hb-manager",
      "lp": "have-backbone",
      "q": "Tell me about a time you disagreed with your manager or a customer."
    },
    {
      "id": "dr-impact",
      "lp": "deliver-results",
      "q": "What is the biggest impact you have had?"
    },
    {
      "id": "dr-missed",
      "lp": "deliver-results",
      "q": "Tell me about a time you missed a deadline."
    },
    {
      "id": "hd-grow",
      "lp": "hire-and-develop",
      "q": "Tell me about a time you helped someone grow."
    },
    {
      "id": "be-team",
      "lp": "best-employer",
      "q": "Tell me about a time you made work better for the people around you."
    },
    {
      "id": "br-impact",
      "lp": "broad-responsibility",
      "q": "Tell me about a time you considered the wider impact of something you built."
    }
  ],
  "rapid_fire": [
    {
      "id": "rf-region-az",
      "q": "Region vs AZ vs edge location?",
      "a": "A Region is a geographic area with multiple isolated AZs. An AZ is one or more data centers with independent power and networking. An edge location is a CloudFront and Route 53 point of presence near users for caching and DNS."
    },
    {
      "id": "rf-ha-web",
      "q": "How do you make a web app highly available on AWS?",
      "a": "Auto Scaling group across at least 2 AZs behind an ALB, Multi-AZ RDS or Aurora, state kept out of instances (ElastiCache, S3), and Route 53 health checks. For a Region failure, add a DR tier."
    },
    {
      "id": "rf-sg-nacl",
      "q": "Security group vs NACL?",
      "a": "Security groups are stateful, attach to instances or network interfaces, and only allow. NACLs are stateless, attach to subnets, have ordered allow and deny rules, so return traffic must be allowed explicitly."
    },
    {
      "id": "rf-subnets",
      "q": "Public vs private subnet? What does a NAT Gateway do?",
      "a": "A public subnet's route table points to an Internet Gateway; a private one does not. A NAT Gateway in a public subnet lets private instances make outbound connections without accepting inbound ones."
    },
    {
      "id": "rf-alb-nlb",
      "q": "ALB vs NLB? When API Gateway?",
      "a": "ALB is layer 7: HTTP routing by path, host, header. NLB is layer 4: TCP and UDP, static IPs, very high throughput, low latency. API Gateway when you want a managed API front door with auth, throttling, and usage plans, often in front of Lambda."
    },
    {
      "id": "rf-s3-classes",
      "q": "S3 storage classes and lifecycle. How do you make S3 cheaper?",
      "a": "Standard for hot data, Intelligent-Tiering when access is unknown, Standard-IA and One Zone-IA for infrequent access, Glacier tiers for archive. Lifecycle rules move or expire objects; also expire old versions and incomplete multipart uploads."
    },
    {
      "id": "rf-ebs-efs-s3",
      "q": "EBS vs EFS vs S3?",
      "a": "EBS is block storage for one instance in one AZ, for boot volumes and databases. EFS is a shared NFS file system across instances and AZs. S3 is object storage over HTTP for data lakes, backups, and static assets."
    },
    {
      "id": "rf-multiaz-replica",
      "q": "RDS Multi-AZ vs read replica?",
      "a": "Specify the deployment: Multi-AZ DB instance has one synchronous non-readable standby for failover. Multi-AZ DB cluster has a writer and two readable standbys in three AZs for supported MySQL/PostgreSQL versions. Separate read replicas generally replicate asynchronously for read scaling; promotion and replication support depend on engine."
    },
    {
      "id": "rf-dynamo-rds",
      "q": "DynamoDB vs RDS? What is a hot partition?",
      "a": "DynamoDB for known access patterns at any scale with fast key lookups and no joins; RDS for joins, ad hoc queries, and multi-table transactions. A hot partition is too much traffic on one partition key; fix it with a higher-cardinality key or write sharding."
    },
    {
      "id": "rf-lambda",
      "q": "Lambda limits and cold starts. When not to use Lambda?",
      "a": "15-minute max runtime, up to 10 GB memory, payload limits. Cold starts add latency for new environments; reduce with provisioned concurrency or SnapStart. Avoid it for long jobs, steady very high throughput, or GPU work."
    },
    {
      "id": "rf-ecs-eks",
      "q": "ECS vs EKS vs Fargate?",